search_title,search_city,title,company,location,description,salary_min,salary_max,created,description_lower,skill_python,skill_sql,skill_excel,skill_power_bi,skill_tableau,skill_machine_learning,skill_r_programming,skill_aws,skill_azure,skill_statistics,skill_spark,skill_hadoop,skill_deep_learning,skill_data_visualization,skill_etl,skill_java
data scientist,bangalore,Data Scientist,Numeric Technologies,"Bangalore, Karnataka","Company: Numeric Technologies Company Website: https://numerictech.com Type: Permanent with Numeric Technologies Numeric, incorporated in 1996 is a worldwide Business & Information Technology, Consultingand Services company. Headquartered in Chicago, IL with additional offices in Miami, Silicon Valley, Luxembourg, UK as well as delivery centers in India (Bengaluru,Hyderabad,Chennai) to serve our customers on offshore needs.We at Numeric Technologies pride ourselves for providing our customers w…",,,2026-06-05T17:19:41Z,"company: numeric technologies company website: https://numerictech.com type: permanent with numeric technologies numeric, incorporated in 1996 is a worldwide business & information technology, consultingand services company. headquartered in chicago, il with additional offices in miami, silicon valley, luxembourg, uk as well as delivery centers in india (bengaluru,hyderabad,chennai) to serve our customers on offshore needs.we at numeric technologies pride ourselves for providing our customers w…",False,False,False,False,False,False,False,False,False,False,False,False,False,False,False,False
data scientist,bangalore,Data Scientist,TEKsystems Global Services in India,"Bangalore, Karnataka","Python, JavaScript/ Java/ Scala, R, AI/ML platform experience – Databricks, LangChain, Langraph, MLFlow, DBRX instruct, Llama, Cohere, Google ADK, A2A, MCP, Argo, AWS/Azure/GCP. Looking for an Lead Application Engineer (AI/ML) with 7 years of experience in Python, JavaScript/ Java/ Scala, R, AI/ML platform experience – Databricks, LangChain, Langraph, MLFlow, DBRX instruct, Llama, Cohere, Google ADK, A2A, MCP, Argo, AWS/Azure/GCP. Candidate is expected to work independently , engage directly wi…",,,2026-04-16T15:06:04Z,"python, javascript/ java/ scala, r, ai/ml platform experience – databricks, langchain, langraph, mlflow, dbrx instruct, llama, cohere, google adk, a2a, mcp, argo, aws/azure/gcp. looking for an lead application engineer (ai/ml) with 7 years of experience in python, javascript/ java/ scala, r, ai/ml platform experience – databricks, langchain, langraph, mlflow, dbrx instruct, llama, cohere, google adk, a2a, mcp, argo, aws/azure/gcp. candidate is expected to work independently , engage directly wi…",True,False,False,False,False,False,False,True,True,False,False,False,False,False,False,True
data scientist,bangalore,Remote Data Scientist,Turing,"Bangalore, Karnataka","About Turing: Based in San Francisco, California, Turing is the world’s leading research accelerator for frontier AI labs and a trusted partner for global enterprises deploying advanced AI systems. Turing supports customers in two ways: first, by accelerating frontier research with high-quality data, advanced training pipelines, plus top AI researchers who specialize in coding, reasoning, STEM, multilinguality, multimodality, and agents; and second, by applying that expertise to help enterprise…",,,2026-06-26T20:57:13Z,"about turing: based in san francisco, california, turing is the world’s leading research accelerator for frontier ai labs and a trusted partner for global enterprises deploying advanced ai systems. turing supports customers in two ways: first, by accelerating frontier research with high-quality data, advanced training pipelines, plus top ai researchers who specialize in coding, reasoning, stem, multilinguality, multimodality, and agents; and second, by applying that expertise to help enterprise…",False,False,False,False,False,False,False,False,False,False,False,False,False,False,False,False
data scientist,bangalore,Lead Data Scientist,Navi,"Bangalore, Karnataka","About the Team The Data Science team at Navi plays a central role in building intelligent solutions that power our products and drive business impact. We work across key domains such as Lending, Collections, KYC, UPI Growth and Ads recommendation, applying advanced machine learning/deep learning/GenAI techniques to solve high-impact challenges. Our work involves a diverse range of data types—including text, image, and tabular data—and we closely collaborate with cross-functional teams like Prod…",,,2026-06-24T16:52:10Z,"about the team the data science team at navi plays a central role in building intelligent solutions that power our products and drive business impact. we work across key domains such as lending, collections, kyc, upi growth and ads recommendation, applying advanced machine learning/deep learning/genai techniques to solve high-impact challenges. our work involves a diverse range of data types—including text, image, and tabular data—and we closely collaborate with cross-functional teams like prod…",False,False,False,False,False,True,False,False,False,False,False,False,True,False,False,False
data scientist,bangalore,Sr. Data Scientist,AB InBev GCC India,"Bangalore, Karnataka","Dreaming big is in our DNA. It’s who we are as a company. It’s our culture. It’s our heritage. And more than ever, it’s our future. A future where we’re always looking forward. Always serving up new ways to meet life’s moments. A future where we keep dreaming bigger. We look for people with passion, talent, and curiosity, and provide them with the teammates, resources and opportunities to unleash their full potential. The power we create together – when we combine your strengths with ours – is …",,,2026-06-04T16:48:40Z,"dreaming big is in our dna. it’s who we are as a company. it’s our culture. it’s our heritage. and more than ever, it’s our future. a future where we’re always looking forward. always serving up new ways to meet life’s moments. a future where we keep dreaming bigger. we look for people with passion, talent, and curiosity, and provide them with the teammates, resources and opportunities to unleash their full potential. the power we create together – when we combine your strengths with ours – is …",False,False,False,False,False,False,False,False,False,False,False,False,False,False,False,False
data scientist,bangalore,Principal Data Scientist,MakeMyTrip,"Bangalore, Karnataka","Requirements: MakeMyTrip-GoIbibo data science group is looking for seasoned data scientist expert for hotel ranking recommendation systems. An ideal candidate would: · Build, deploy & monitor state of the art DL and ML ranking search models, learning to rank algorithms, position and click debiasing strategies, multi-objective ranking boosting algorithms. · Discuss with stakeholders (product and tech) at various stages of project, from data, to problem specifics, to A/B experimentation and model…",,,2026-06-06T07:38:26Z,"requirements: makemytrip-goibibo data science group is looking for seasoned data scientist expert for hotel ranking recommendation systems. an ideal candidate would: · build, deploy & monitor state of the art dl and ml ranking search models, learning to rank algorithms, position and click debiasing strategies, multi-objective ranking boosting algorithms. · discuss with stakeholders (product and tech) at various stages of project, from data, to problem specifics, to a/b experimentation and model…",False,False,False,False,False,False,False,False,False,False,False,False,False,False,False,False
data scientist,bangalore,Data Science Manager,Navi,"Bangalore, Karnataka","About the Team The Data Science team at Navi plays a central role in building intelligent solutions that power our products and drive business impact. We work across key domains such as Lending, Collections, KYC, UPI Growth and Ads recommendation, applying advanced machine learning/deep learning/GenAI techniques to solve high-impact challenges. Our work involves a diverse range of data types—including text, image, and tabular data—and we closely collaborate with cross-functional teams like Prod…",,,2026-06-24T16:49:14Z,"about the team the data science team at navi plays a central role in building intelligent solutions that power our products and drive business impact. we work across key domains such as lending, collections, kyc, upi growth and ads recommendation, applying advanced machine learning/deep learning/genai techniques to solve high-impact challenges. our work involves a diverse range of data types—including text, image, and tabular data—and we closely collaborate with cross-functional teams like prod…",False,False,False,False,False,True,False,False,False,False,False,False,True,False,False,False
data scientist,bangalore,Data Scientist II,Wayfair,"Bangalore, Karnataka","Candidates for this position are preferred to be based in Bangalore, India and will be expected to comply with their team's hybrid work schedule requirements. Data Scientist II Wayfair Data Science is the engine that powers an enterprise obsessed with data. The Wayfair websites generate over 100M clicks from the millions of customers that visit our sites every day to discover and purchase home goods. The Customer Tech Data Science team is focused on understanding and optimizing customer behavio…",,,2026-06-14T14:48:06Z,"candidates for this position are preferred to be based in bangalore, india and will be expected to comply with their team's hybrid work schedule requirements. data scientist ii wayfair data science is the engine that powers an enterprise obsessed with data. the wayfair websites generate over 100m clicks from the millions of customers that visit our sites every day to discover and purchase home goods. the customer tech data science team is focused on understanding and optimizing customer behavio…",False,False,False,False,False,False,False,False,False,False,False,False,False,False,False,False
data scientist,delhi,Data Scientist,Crescendo Global,"Delhi, India","Data Scientist – Insurance Analytics Role Summary We are seeking a Senior Data Scientist (6–7 years of experience) to support an analytics initiative focused on the insurance domain. This is a client facing role requiring strong analytical expertise, hands-on modeling experience and the ability to independently drive analysis, present insights and collaborate with stakeholders. The ideal candidate will have a solid foundation in statistical modeling and hypothesis testing, deep experience in tr…",,,2026-05-07T16:21:00Z,"data scientist – insurance analytics role summary we are seeking a senior data scientist (6–7 years of experience) to support an analytics initiative focused on the insurance domain. this is a client facing role requiring strong analytical expertise, hands-on modeling experience and the ability to independently drive analysis, present insights and collaborate with stakeholders. the ideal candidate will have a solid foundation in statistical modeling and hypothesis testing, deep experience in tr…",False,False,False,False,False,False,False,False,False,False,False,False,False,False,False,False
data scientist,delhi,Data Scientist,Tata Consultancy Services,"Delhi, India","TCS is conducting face to face interview on 13th June for Data Scientist at TCS Delhi Office Job Title : Data Scienctist Experience : 6 to 12 years Venue: TCS Yamuna 0ffice, Plot No. 20 & 21, Tower 6, 1st floor, Building B2Seaview Developers SEZ / Unitech Infospace Noida-Greater Noida Expressway, Sector 135, Noida Job description: Strong expertise in Python (NumPy, Pandas, Scikit-learn) Hands-on experience with ML algorithms (Regression, Classification, Clustering) Strong knowledge of Statistic…",,,2026-06-09T18:07:37Z,"tcs is conducting face to face interview on 13th june for data scientist at tcs delhi office job title : data scienctist experience : 6 to 12 years venue: tcs yamuna 0ffice, plot no. 20 & 21, tower 6, 1st floor, building b2seaview developers sez / unitech infospace noida-greater noida expressway, sector 135, noida job description: strong expertise in python (numpy, pandas, scikit-learn) hands-on experience with ml algorithms (regression, classification, clustering) strong knowledge of statistic…",True,False,False,False,False,False,False,False,False,False,False,False,False,False,False,False
data scientist,delhi,Data Scientist,Tata Consultancy Services,"Delhi, India","Exp:4-12 yrs JD: Advanced degree in mathematics, statistics, computer science, or related field. · Strong knowledge of statistical analysis, machine learning, and deep learning. · Developing advanced algorithms and models to extract valuable insights from complex datasets, with a focus on generative AI and large language models (LLMs). · Conducting thorough exploratory data analysis (EDA) to uncover patterns, anomalies, and correlations in the data for NLP/Time series/Vision capability streams.…",,,2026-06-07T07:50:30Z,"exp:4-12 yrs jd: advanced degree in mathematics, statistics, computer science, or related field. · strong knowledge of statistical analysis, machine learning, and deep learning. · developing advanced algorithms and models to extract valuable insights from complex datasets, with a focus on generative ai and large language models (llms). · conducting thorough exploratory data analysis (eda) to uncover patterns, anomalies, and correlations in the data for nlp/time series/vision capability streams.…",False,False,False,False,False,True,False,False,False,True,False,False,True,False,False,False
data scientist,delhi,Remote Data Scientist,Turing,"Delhi, India","About Turing: Based in San Francisco, California, Turing is the world’s leading research accelerator for frontier AI labs and a trusted partner for global enterprises deploying advanced AI systems. Turing supports customers in two ways: first, by accelerating frontier research with high-quality data, advanced training pipelines, plus top AI researchers who specialize in coding, reasoning, STEM, multilinguality, multimodality, and agents; and second, by applying that expertise to help enterprise…",,,2026-06-26T14:56:06Z,"about turing: based in san francisco, california, turing is the world’s leading research accelerator for frontier ai labs and a trusted partner for global enterprises deploying advanced ai systems. turing supports customers in two ways: first, by accelerating frontier research with high-quality data, advanced training pipelines, plus top ai researchers who specialize in coding, reasoning, stem, multilinguality, multimodality, and agents; and second, by applying that expertise to help enterprise…",False,False,False,False,False,False,False,False,False,False,False,False,False,False,False,False
data scientist,delhi,Data Scientist(AIML),Tata Consultancy Services,"Delhi, India","WALK-IN Interview On 13-June -2026 _Data Scientist_Delhi Role - Data Scientist Experience - 4 to 15 years Location: TCS Yamuna 0ffice, Plot No. 20 & 21, Tower 6, 1st floor, Building B2Seaview Developers SEZ / Unitech Infospace Noida-Greater Noida Expressway, Sector 135, Noida Job description · Advanced degree in mathematics, statistics, computer science, or related field. · Strong knowledge of statistical analysis, machine learning, and deep learning. · Developing advanced algorithms and models…",,,2026-06-06T07:43:54Z,"walk-in interview on 13-june -2026 _data scientist_delhi role - data scientist experience - 4 to 15 years location: tcs yamuna 0ffice, plot no. 20 & 21, tower 6, 1st floor, building b2seaview developers sez / unitech infospace noida-greater noida expressway, sector 135, noida job description · advanced degree in mathematics, statistics, computer science, or related field. · strong knowledge of statistical analysis, machine learning, and deep learning. · developing advanced algorithms and models…",False,False,False,False,False,True,False,False,False,True,False,False,True,False,False,False
data scientist,delhi,Data Scientist- F2F discussion - Delhi,Tata Consultancy Services,"Delhi, India","Dear Tech Professional Greetings from Tata Consultancy Services (TCS) TCS has always been in the spotlight for being adept in “the next big technologies”. What we can offer you is a space to explore varied technologies and quench your techie soul. What we are looking for: Data Scientist Interview Location: Delhi Interview Mode: F2F discussion Exp : 4-12 Years 4-10 years of professional experience in data science, machine learning Strong proficiency in Python is mandatory, with experience in dat…",,,2026-06-06T07:41:30Z,"dear tech professional greetings from tata consultancy services (tcs) tcs has always been in the spotlight for being adept in “the next big technologies”. what we can offer you is a space to explore varied technologies and quench your techie soul. what we are looking for: data scientist interview location: delhi interview mode: f2f discussion exp : 4-12 years 4-10 years of professional experience in data science, machine learning strong proficiency in python is mandatory, with experience in dat…",True,False,False,False,False,True,False,False,False,False,False,False,False,False,False,False
data scientist,delhi,Data Scientist(candidates with 6 yrs exp only),Tata Consultancy Services,"Delhi, India","TCS Hiring TCS is Having walkin Drive for skill Data Scientist At TCS Delhi Location on 13th June 2026 Saturday exp req:6 yrsInterview Venue:TCS Yamuna 0ffice, Plot No. 20 & 21, Tower 6, 1st floor, Building B2Seaview Developers SEZ / Unitech Infospace Noida-Greater Noida Expressway, Sector 135, No id a JDMust Have – Data S cienceStrong expertise in Python (NumPy, Pandas, Scikit- learn)Hands-on experience with ML algorithms (Regression, Classification, Clust ering)Strong knowledge of Statistics …",,,2026-06-03T16:38:49Z,"tcs hiring tcs is having walkin drive for skill data scientist at tcs delhi location on 13th june 2026 saturday exp req:6 yrsinterview venue:tcs yamuna 0ffice, plot no. 20 & 21, tower 6, 1st floor, building b2seaview developers sez / unitech infospace noida-greater noida expressway, sector 135, no id a jdmust have – data s ciencestrong expertise in python (numpy, pandas, scikit- learn)hands-on experience with ml algorithms (regression, classification, clust ering)strong knowledge of statistics …",True,False,False,False,False,False,False,False,False,True,False,False,False,False,False,False
data scientist,delhi,Remote Data Engineer,Turing,"Delhi, India","About Turing: Based in San Francisco, California, Turing is the world’s leading research accelerator for frontier AI labs and a trusted partner for global enterprises deploying advanced AI systems. Turing supports customers in two ways: first, by accelerating frontier research with high-quality data, advanced training pipelines, plus top AI researchers who specialize in coding, reasoning, STEM, multilinguality, multimodality, and agents; and second, by applying that expertise to help enterprise…",,,2026-06-26T19:01:04Z,"about turing: based in san francisco, california, turing is the world’s leading research accelerator for frontier ai labs and a trusted partner for global enterprises deploying advanced ai systems. turing supports customers in two ways: first, by accelerating frontier research with high-quality data, advanced training pipelines, plus top ai researchers who specialize in coding, reasoning, stem, multilinguality, multimodality, and agents; and second, by applying that expertise to help enterprise…",False,False,False,False,False,False,False,False,False,False,False,False,False,False,False,False
data scientist,delhi,Databricks Engineer - F2F Interview - Delhi,Tata Consultancy Services,"Delhi, India","Greetings from Tata Consultancy Services Role : Databricks Engineer Experience: 4 to 12 Years Interview Mod e : F2F Interview Date: 13 June 2026(Saturday) Location: Delhi (Noida) Job Description Databricks Engineer •Databricks: In-depth knowledge of Databricks, Spark, Delta Lake, and related technologies. •Programming: Strong programming skills in Python, Scala, or Java. •Data Engineering: Experience with data engineering, data warehousing, and ETL tools. •Expertise in SQL, Unity Catalogue, Wor…",,,2026-06-06T07:40:22Z,"greetings from tata consultancy services role : databricks engineer experience: 4 to 12 years interview mod e : f2f interview date: 13 june 2026(saturday) location: delhi (noida) job description databricks engineer •databricks: in-depth knowledge of databricks, spark, delta lake, and related technologies. •programming: strong programming skills in python, scala, or java. •data engineering: experience with data engineering, data warehousing, and etl tools. •expertise in sql, unity catalogue, wor…",True,True,False,False,False,False,False,False,False,False,True,False,False,False,True,True
data scientist,delhi,Azure Data Factory - F2F Interview - Delhi,Tata Consultancy Services,"Delhi, India","Greeting from Tata Consultancy Services Role : Azure Data Factory Experience: 5 to 12 Years Interview Mod e : F2F Interview Date: 13 June 2026(Saturday) Location: Delhi (Noida) Job Description Azure Data Factory •Azure Data Factory: In-depth knowledge of ADF, including data integration, ETL development, and pipeline orchestration. •Azure Synapse Analytics: Strong understanding of Azure Synapse Analytics, including data warehousing, data modeling, and data querying. •Azure Data Services: Familia…",,,2026-06-06T07:43:21Z,"greeting from tata consultancy services role : azure data factory experience: 5 to 12 years interview mod e : f2f interview date: 13 june 2026(saturday) location: delhi (noida) job description azure data factory •azure data factory: in-depth knowledge of adf, including data integration, etl development, and pipeline orchestration. •azure synapse analytics: strong understanding of azure synapse analytics, including data warehousing, data modeling, and data querying. •azure data services: familia…",False,False,False,False,False,False,False,False,True,False,False,False,False,False,True,False
data scientist,delhi,Machine Learning Engineer,Gabeo.ai,"Delhi, India"," Immediate Joiners Only - Please apply only if you're available to start right away. If you're currently serving a notice period or cannot join immediately, we kindly ask that you refrain from applying.​   We're only interested in candidates who have experience working with AI Agent frameworks —such as LangChain, Langraph , AutoGen, CrewAI, Auto-GPT, or custom-built systems. If you've explored multi-agent coordination, autonomous task execution, memory management, or tool-based reasoning using …",,,2026-03-29T17:51:29Z," immediate joiners only - please apply only if you're available to start right away. if you're currently serving a notice period or cannot join immediately, we kindly ask that you refrain from applying.​   we're only interested in candidates who have experience working with ai agent frameworks —such as langchain, langraph , autogen, crewai, auto-gpt, or custom-built systems. if you've explored multi-agent coordination, autonomous task execution, memory management, or tool-based reasoning using …",False,False,False,False,False,False,False,False,False,False,False,False,False,False,False,False
data scientist,delhi,Program Director – Online Higher Education | A Reputed University in Delhi NCR,FyndBridge Consultants & Advisors,"Delhi, India","We are looking for experienced academic leaders to drive the growth, quality, and innovation of online degree and certification programs across Management, Computer Science, and Commerce domains. Key Responsibilities: Lead the design, development, and continuous enhancement of undergraduate, postgraduate, and executive education programs. Develop industry-relevant curricula aligned with emerging trends, technology advancements, and learner needs. Drive innovation in online learning through expe…",,,2026-06-07T17:40:49Z,"we are looking for experienced academic leaders to drive the growth, quality, and innovation of online degree and certification programs across management, computer science, and commerce domains. key responsibilities: lead the design, development, and continuous enhancement of undergraduate, postgraduate, and executive education programs. develop industry-relevant curricula aligned with emerging trends, technology advancements, and learner needs. drive innovation in online learning through expe…",False,False,False,False,False,False,False,False,False,False,False,False,False,False,False,False
data scientist,delhi,Assistant Manager,.Kreate,"Delhi, India","We are looking for an experienced professional from the Renewable Energy sector to lead Forecasting & Scheduling (F&S) operations for our Wind and Solar portfolio. Key Responsibilities: Ensure project accuracy for all Wind & Solar projects handled monthly. Lead and manage Forecasting (Wind, Solar, and Demand) control room/shift operations. Perform DSM and De-pooling calculations and provide monthly commercial reports to clients. Analyze forecast quality regularly and implement innovative method…",,,2026-06-24T16:49:21Z,"we are looking for an experienced professional from the renewable energy sector to lead forecasting & scheduling (f&s) operations for our wind and solar portfolio. key responsibilities: ensure project accuracy for all wind & solar projects handled monthly. lead and manage forecasting (wind, solar, and demand) control room/shift operations. perform dsm and de-pooling calculations and provide monthly commercial reports to clients. analyze forecast quality regularly and implement innovative method…",False,False,False,False,False,False,False,False,False,False,False,False,False,False,False,False
