search_title,search_city,title,company,location,description,salary_min,salary_max,created,description_lower,skill_python,skill_sql,skill_excel,skill_power_bi,skill_tableau,skill_machine_learning,skill_r_programming,skill_aws,skill_azure,skill_statistics,skill_spark,skill_hadoop,skill_deep_learning,skill_data_visualization,skill_etl,skill_java
data analyst,bangalore,Data Analyst,Fractal,"Bangalore, Karnataka","Job Description Data Analyst: Tableau, SQL, Data Analys is Responsibilities: Collect, clean, and analyze data to support business decision-making. Develop reports, dashboards, and visualizations to communicate insights. Identify trends, patterns, and anomalies in large datasets. Collaborate with cross-functional teams to understand data needs and deliver actionable solutions. Perform ad hoc analysis and present findings to stakeholders. Ensure data accuracy, consistency, and integrity across sy…",,,2026-06-27T15:01:20Z,"job description data analyst: tableau, sql, data analys is responsibilities: collect, clean, and analyze data to support business decision-making. develop reports, dashboards, and visualizations to communicate insights. identify trends, patterns, and anomalies in large datasets. collaborate with cross-functional teams to understand data needs and deliver actionable solutions. perform ad hoc analysis and present findings to stakeholders. ensure data accuracy, consistency, and integrity across sy…",False,True,False,False,True,False,False,False,False,False,False,False,False,False,False,False
data analyst,bangalore,Data Analyst,RapidBrains,"Bangalore, Karnataka","Job Title: Data Analyst Location: Bangalore/Pune/Gurgaon(Hybrid) Experience: 5 Experience Notice Period: Immediately Overview The Data Analyst will support Private Market investment operations by delivering trusted, well‑governed data solutions, leveraging strong expertise in the Citco fund administration environment. Partnering with Investment, Risk, Finance, and Data & Analytics teams, the role translates business requirements into clear data definitions, business rules, and quality standards…",,,2026-06-25T18:52:28Z,"job title: data analyst location: bangalore/pune/gurgaon(hybrid) experience: 5 experience notice period: immediately overview the data analyst will support private market investment operations by delivering trusted, well‑governed data solutions, leveraging strong expertise in the citco fund administration environment. partnering with investment, risk, finance, and data & analytics teams, the role translates business requirements into clear data definitions, business rules, and quality standards…",False,False,False,False,False,False,False,False,False,False,False,False,False,False,False,False
data analyst,bangalore,Data Analyst,Epsilon,"Bangalore, Karnataka","Summary The Data Analyst will be a key member of the Technical Operations team, serving as a key link between Engineering and Operations. This role focuses on transforming data into actionable insights that improve operational efficiency and enhance client outcomes. You will work on client reporting, operational requests, and data-driven initiatives, leveraging tools such as Oracle SQL, Microsoft Excel, and other analytics platforms. This role also involves collaborating with cross-functional t…",,,2026-06-13T10:50:13Z,"summary the data analyst will be a key member of the technical operations team, serving as a key link between engineering and operations. this role focuses on transforming data into actionable insights that improve operational efficiency and enhance client outcomes. you will work on client reporting, operational requests, and data-driven initiatives, leveraging tools such as oracle sql, microsoft excel, and other analytics platforms. this role also involves collaborating with cross-functional t…",False,True,True,False,False,False,False,False,False,False,False,False,False,False,False,False
data analyst,bangalore,Data Analyst,Triomics,"Bangalore, Karnataka","About Triomics: Triomics helps oncology organizations scale clinical research and high-quality data creation without scaling headcount. Our AI platform - powered by OncoLLM™- automates the operational work behind trial screening, eligibility interpretation, and oncology data abstraction across Prism (trial matching), Harmony (registry  RWE curation), and Symphony (clinician copilot). Built for real-world hospital workflows, Triomics integrates with EHRs and CTMS systems and is deployed with lea…",,,2026-06-25T18:53:41Z,"about triomics: triomics helps oncology organizations scale clinical research and high-quality data creation without scaling headcount. our ai platform - powered by oncollm™- automates the operational work behind trial screening, eligibility interpretation, and oncology data abstraction across prism (trial matching), harmony (registry  rwe curation), and symphony (clinician copilot). built for real-world hospital workflows, triomics integrates with ehrs and ctms systems and is deployed with lea…",False,False,False,False,False,False,False,False,False,False,False,False,False,False,False,False
data analyst,bangalore,Data Analyst,Kamakhya Analytics Private Limited,"Bangalore, Karnataka","Location : Bangalore-Hybrid Department/Team : Modelling, Pattern Recognition and Insights About the Company : Kamakhya Analytics is a technology-driven research and consulting organisation helping leaders, parties, and institutions decode India’s political and policy landscape. We bring together survey science, data analytics, and strategic insight to answer complex questions about public opinion, governance, and performance. From ground-level fieldwork to advanced modelling and interpretation,…",,,2026-06-18T15:54:32Z,"location : bangalore-hybrid department/team : modelling, pattern recognition and insights about the company : kamakhya analytics is a technology-driven research and consulting organisation helping leaders, parties, and institutions decode india’s political and policy landscape. we bring together survey science, data analytics, and strategic insight to answer complex questions about public opinion, governance, and performance. from ground-level fieldwork to advanced modelling and interpretation,…",False,False,False,False,False,False,False,False,False,False,False,False,False,False,False,False
data analyst,bangalore,Data Analyst,GreedyGame,"Bangalore, Karnataka","About the Company: GreedyGame founded in 2013 by Arpit Jain [CEO] is a leading ad-tech company that's been driving app growth and monetization We’ve built a sustainable and profitable business for over 7 years without chasing vanity metrics and successfully completed our 0→1 journey, we’re now scaling rapidly (1→10 phase) As a Google Publishing Partner , we serve 100M daily ad impressions and support 5,000 apps and games worldwide—delivering up to 75% revenue uplift Trusted by brands like Amazo…",,,2026-06-21T17:10:58Z,"about the company: greedygame founded in 2013 by arpit jain [ceo] is a leading ad-tech company that's been driving app growth and monetization we’ve built a sustainable and profitable business for over 7 years without chasing vanity metrics and successfully completed our 0→1 journey, we’re now scaling rapidly (1→10 phase) as a google publishing partner , we serve 100m daily ad impressions and support 5,000 apps and games worldwide—delivering up to 75% revenue uplift trusted by brands like amazo…",False,False,False,False,False,False,False,False,False,False,False,False,False,False,False,False
data analyst,bangalore,Senior Data Analyst,"Enterprise Minds, Inc","Bangalore, Karnataka","Job Description – Data Analyst (E-commerce Focus) Role: Senior Data Analyst Experience: 5 -8 Years Employment Type: Full Time Role Overview We are seeking a detail-oriented and analytical Data Analyst with strong experience in the e-commerce domain. The role requires analyzing customer behavior, sales performance, and operational metrics to generate actionable insights that drive business growth. The ideal candidate should be proficient in data analysis, reporting, and visualization while worki…",,,2026-06-12T00:13:52Z,"job description – data analyst (e-commerce focus) role: senior data analyst experience: 5 -8 years employment type: full time role overview we are seeking a detail-oriented and analytical data analyst with strong experience in the e-commerce domain. the role requires analyzing customer behavior, sales performance, and operational metrics to generate actionable insights that drive business growth. the ideal candidate should be proficient in data analysis, reporting, and visualization while worki…",False,False,False,False,False,False,False,False,False,False,False,False,False,False,False,False
data analyst,bangalore,Senior Data Analyst,Kamakhya Analytics Private Limited,"Bangalore, Karnataka","JOB DESCRIPTION - SENIOR DATA ANALYST Location: Bangalore-Hybrid Department : Analytics Team : Survey Insights and Reporting About the Company: Kamakhya Analytics is a technology-driven research and consulting organisation helping leaders, parties, and institutions decode India’s political and policy landscape. We bring together survey science, data analytics, and strategic insight to answer complex questions about public opinion, governance, and performance. From ground-level fieldwork to adva…",,,2026-06-06T17:27:15Z,"job description - senior data analyst location: bangalore-hybrid department : analytics team : survey insights and reporting about the company: kamakhya analytics is a technology-driven research and consulting organisation helping leaders, parties, and institutions decode india’s political and policy landscape. we bring together survey science, data analytics, and strategic insight to answer complex questions about public opinion, governance, and performance. from ground-level fieldwork to adva…",False,False,False,False,False,False,False,False,False,False,False,False,False,False,False,False
data analyst,bangalore,Remote Data Analyst,Turing,"Bangalore, Karnataka","About Turing: Based in San Francisco, California, Turing is the world’s leading research accelerator for frontier AI labs and a trusted partner for global enterprises deploying advanced AI systems. Turing supports customers in two ways: first, by accelerating frontier research with high-quality data, advanced training pipelines, plus top AI researchers who specialize in coding, reasoning, STEM, multilinguality, multimodality, and agents; and second, by applying that expertise to help enterprise…",,,2026-06-27T00:58:46Z,"about turing: based in san francisco, california, turing is the world’s leading research accelerator for frontier ai labs and a trusted partner for global enterprises deploying advanced ai systems. turing supports customers in two ways: first, by accelerating frontier research with high-quality data, advanced training pipelines, plus top ai researchers who specialize in coding, reasoning, stem, multilinguality, multimodality, and agents; and second, by applying that expertise to help enterprise…",False,False,False,False,False,False,False,False,False,False,False,False,False,False,False,False
data analyst,bangalore,Senior Data Analyst,"Enterprise Minds, Inc","Bangalore, Karnataka", We're Hiring – Data Analyst (E-commerce Focus) | 5 Years Experience | F2F Interview Location: Bengalore Experience: 5 Years Interview Mode: Face-to-Face (Friday) Employment Type : Full-Tim eWe are looking for an experienced Data Analys t with a strong background in the E-commerce domai n to join our team . Key Skill s:Strong SQL & Data Analys isAdvanced Excel / Google Shee tsPower BI / Tableau / Look erGoogle Analytics / Firebase / Mixpanel / Adobe Analyti csETL Processes & Data Pipelin esBasi…,,,2026-06-26T00:54:33Z, we're hiring – data analyst (e-commerce focus) | 5 years experience | f2f interview location: bengalore experience: 5 years interview mode: face-to-face (friday) employment type : full-tim ewe are looking for an experienced data analys t with a strong background in the e-commerce domai n to join our team . key skill s:strong sql & data analys isadvanced excel / google shee tspower bi / tableau / look ergoogle analytics / firebase / mixpanel / adobe analyti csetl processes & data pipelin esbasi…,False,True,True,True,True,False,False,False,False,False,False,False,False,False,True,False
data analyst,bangalore,Senior Data Analyst,StockGro,"Bangalore, Karnataka","Company Vision StockGro is a mobile-first cross-platform (Android & iOS, Mobile  Web App) Fintech product that’s empowering 25 million users to master the art of trading and investment in a risk-free and gamified manner. At StockGro - India’s First and Largest Social Investment Platform, users indulge in Social Investing and learn various trading strategies by interacting with leading fund managers, F&O traders, and algo traders. About StockGro Founded in January 2020 by former venture capitali…",,,2026-06-21T01:09:28Z,"company vision stockgro is a mobile-first cross-platform (android & ios, mobile  web app) fintech product that’s empowering 25 million users to master the art of trading and investment in a risk-free and gamified manner. at stockgro - india’s first and largest social investment platform, users indulge in social investing and learn various trading strategies by interacting with leading fund managers, f&o traders, and algo traders. about stockgro founded in january 2020 by former venture capitali…",False,False,False,False,False,False,False,False,False,False,False,False,False,False,False,False
data analyst,bangalore,Senior Data Analyst,Masai,"Bangalore, Karnataka","We are looking for a Senior Data Analyst who can turn complex business data into clear insights, actionable recommendations, and measurable business impact. The role requires strong analytical thinking, hands-on experience with data tools, and the ability to partner closely with business, product, sales, operations, and leadership teams. The ideal candidate should be comfortable working with large datasets, building dashboards, identifying trends, solving ambiguous business problems, and influe…",,,2026-06-25T00:52:09Z,"we are looking for a senior data analyst who can turn complex business data into clear insights, actionable recommendations, and measurable business impact. the role requires strong analytical thinking, hands-on experience with data tools, and the ability to partner closely with business, product, sales, operations, and leadership teams. the ideal candidate should be comfortable working with large datasets, building dashboards, identifying trends, solving ambiguous business problems, and influe…",False,False,False,False,False,False,False,False,False,False,False,False,False,False,False,False
data analyst,bangalore,Senior Data Analyst,Media.net,"Bangalore, Karnataka","About Us Media.net is one of the world's leading companies in the Contextual Advertising space that provides a wide range of advertising and traffic monetization solutions. Since its founding, Media.net has constantly broken new ground in building innovative contextual advertising solutions. While our HQ is in Dubai, our employees are spread across key operation centers in New York, Los Angeles, Dubai, Zurich, Mumbai and Bangalore. Media.net is both large and small! It’s got the culture of a st…",,,2026-06-15T01:04:02Z,"about us media.net is one of the world's leading companies in the contextual advertising space that provides a wide range of advertising and traffic monetization solutions. since its founding, media.net has constantly broken new ground in building innovative contextual advertising solutions. while our hq is in dubai, our employees are spread across key operation centers in new york, los angeles, dubai, zurich, mumbai and bangalore. media.net is both large and small! it’s got the culture of a st…",False,False,False,False,False,False,False,False,False,False,False,False,False,False,False,False
data analyst,bangalore,Data Analyst  PowerBI,Tata Consultancy Services,"Bangalore, Karnataka",TCS hiring for Data Analysis  Power BI Location: Bangalor e Experience: 4 -8 Must Ha ve: Data Anal ysisPowe r BI ITSM,,,2026-06-20T17:08:14Z,tcs hiring for data analysis  power bi location: bangalor e experience: 4 -8 must ha ve: data anal ysispowe r bi itsm,False,False,False,True,False,False,False,False,False,False,False,False,False,False,False,False
data analyst,bangalore,CRM Data Analyst and Administrator – Marketing [T500-26814],Talent500,"Bangalore, Karnataka","Talent500 is hiring for one of its clients. About Smith & Howard : Founded over half a century ago, Smith & Howard is a global leader in tax, accounting, and advisory solutions, proudly supporting countless entrepreneurs and businesses in achieving financial success. Smith & Howard Advisory LLC, our integrated Indian hub in Bengaluru, is driving the next wave of accounting industry innovation. Join our remarkable team and work on challenging projects in global audit, tax, and accounting. Positi…",,,2026-06-21T17:10:02Z,"talent500 is hiring for one of its clients. about smith & howard : founded over half a century ago, smith & howard is a global leader in tax, accounting, and advisory solutions, proudly supporting countless entrepreneurs and businesses in achieving financial success. smith & howard advisory llc, our integrated indian hub in bengaluru, is driving the next wave of accounting industry innovation. join our remarkable team and work on challenging projects in global audit, tax, and accounting. positi…",False,False,False,False,False,False,False,False,False,False,False,False,False,False,False,False
data analyst,bangalore,Data Analytics Analyst,IQVIA India,"Bangalore, Karnataka","Project Role: Data Analytics Analyst Work Experience: 3 Years Work location: Bengalore Work Mode: Hybrid Must Have Skills: Work on secondary data analysis (patients, physicians, pharmacists),forecasting reports Use Power BI for reporting and dashboards Join us on our exciting journey! About IQVIA IQVIA is a leading global provider of advanced analytics, technology solutions, and clinical research services to the life sciences industry. IQVIA creates intelligent connections across all aspects of…",,,2026-06-24T16:48:02Z,"project role: data analytics analyst work experience: 3 years work location: bengalore work mode: hybrid must have skills: work on secondary data analysis (patients, physicians, pharmacists),forecasting reports use power bi for reporting and dashboards join us on our exciting journey! about iqvia iqvia is a leading global provider of advanced analytics, technology solutions, and clinical research services to the life sciences industry. iqvia creates intelligent connections across all aspects of…",False,False,False,True,False,False,False,False,False,False,False,False,False,False,False,False
data analyst,bangalore,Data Quality Analyst,Ujjivan Small Finance Bank,"Bangalore, Karnataka","JOB DESCRIPTION The Data Quality Analyst will support the monitoring, analysis, and improvement of enterprise data quality across the bank. The role focuses on executing data quality checks, identifying issues, and supporting resolution, ensuring reliable data for analytics, regulatory reporting, and AI initiatives. This role plays a key part in building a culture of data trust and accountability across business and technology teams. Key Responsibilities Execute data quality checks and validati…",,,2026-06-25T18:52:26Z,"job description the data quality analyst will support the monitoring, analysis, and improvement of enterprise data quality across the bank. the role focuses on executing data quality checks, identifying issues, and supporting resolution, ensuring reliable data for analytics, regulatory reporting, and ai initiatives. this role plays a key part in building a culture of data trust and accountability across business and technology teams. key responsibilities execute data quality checks and validati…",False,False,False,False,False,False,False,False,False,False,False,False,False,False,False,False
data analyst,bangalore,Data Security Analyst,NuSummit Cybersecurity,"Bangalore, Karnataka","Looking for Immediate to 30 days Joiners Only. Required Qualification:BE/ B.Tech/ M.Tech/ MSc/ MCA Monitoring and managing the Forcepoint DLP system Adding exceptions to the policies based on pre-defined criteria Collect, monitoring of endpoints, Web,Email, etc and analyse data produced by the client DLP system Defining and deploying DLP Endpoint profiles Adding and Managing Access Roles in DLP (super user, system admin, policy manager,incident manager, external auditor) DLP Server upgrade acti…",,,2026-06-13T10:52:13Z,"looking for immediate to 30 days joiners only. required qualification:be/ b.tech/ m.tech/ msc/ mca monitoring and managing the forcepoint dlp system adding exceptions to the policies based on pre-defined criteria collect, monitoring of endpoints, web,email, etc and analyse data produced by the client dlp system defining and deploying dlp endpoint profiles adding and managing access roles in dlp (super user, system admin, policy manager,incident manager, external auditor) dlp server upgrade acti…",False,False,False,False,False,False,False,False,False,False,False,False,False,False,False,False
data analyst,bangalore,Data Analyst – SAP / SAP MDG | 5 YoE | Any UST Location | Immediate Joiner,UST,"Bangalore, Karnataka","Candidates ready to join immediately can share their details via email for quick processing.  CCTC | ECTC | Notice Period | Location Preference nitin.patil@ust.com Act fast for immediate attention! ⏳ Required Skills: Strong experience as a Data Analyst with enterprise data handling and reporting. Hands-on experience with SAP and understanding of SAP master data objects. Experience with SAP Master Data Governance (MDG) . Good knowledge of master data domains such as Customer, Vendor, Material, F…",,,2026-04-12T08:36:04Z,"candidates ready to join immediately can share their details via email for quick processing.  cctc | ectc | notice period | location preference nitin.patil@ust.com act fast for immediate attention! ⏳ required skills: strong experience as a data analyst with enterprise data handling and reporting. hands-on experience with sap and understanding of sap master data objects. experience with sap master data governance (mdg) . good knowledge of master data domains such as customer, vendor, material, f…",False,False,False,False,False,False,False,False,False,False,False,False,False,False,False,False
data analyst,bangalore,Sr AI Data Quality Analyst [T500-26163],FM,"Bangalore, Karnataka","About FM: FM is a 190-year-old, Fortune 500 commercial property insurance company of 6,000 employees with a unique focus on science and risk engineering. Serving over a quarter of the Fortune 500 and major corporations globally, they deliver data-driven strategies that enhance resilience, ensure business continuity, and empower organizations to thrive. FM India located in Bengaluru is a strategic location for driving FM's global operational efficiency that allows them to leverage the country’s …",,,2026-06-21T17:12:00Z,"about fm: fm is a 190-year-old, fortune 500 commercial property insurance company of 6,000 employees with a unique focus on science and risk engineering. serving over a quarter of the fortune 500 and major corporations globally, they deliver data-driven strategies that enhance resilience, ensure business continuity, and empower organizations to thrive. fm india located in bengaluru is a strategic location for driving fm's global operational efficiency that allows them to leverage the country’s …",False,False,False,False,False,False,False,False,False,False,False,False,False,False,False,False
data analyst,delhi,Data Analyst,CRS Outsourcing PVT.LTD,"Delhi, India","Company Description CRS Outsourcing PVT. LTD. is a recruiting company. Team members work closely with domestic and international clients across diverse industries. CRS Outsourcing values integrity, collaboration, and continuous learning, and encourages employees to develop both technical and professional skills. Role Description This is a full-time, on-site Data Analyst role in Canada and Australia. The Data Analyst will collect, clean, and validate data from multiple sources to ensure accuracy…",,,2026-06-05T17:20:51Z,"company description crs outsourcing pvt. ltd. is a recruiting company. team members work closely with domestic and international clients across diverse industries. crs outsourcing values integrity, collaboration, and continuous learning, and encourages employees to develop both technical and professional skills. role description this is a full-time, on-site data analyst role in canada and australia. the data analyst will collect, clean, and validate data from multiple sources to ensure accuracy…",False,False,False,False,False,False,False,False,False,False,False,False,False,False,False,False
