search_title,search_city,title,company,location,description,salary_min,salary_max,created,description_lower,skill_python,skill_sql,skill_excel,skill_power_bi,skill_tableau,skill_machine_learning,skill_r_programming,skill_aws,skill_azure,skill_statistics,skill_spark,skill_hadoop,skill_deep_learning,skill_data_visualization,skill_etl,skill_java
data analyst,jaipur,Nodejs API Developer,Celebal Technologies Pvt Ltd,"Jaipur, Rajasthan","Job Brief: We are looking for experience in API and Node.js to produce scalable software solutions. You will be part of a cross-functional team that is responsible for the full software development life cycle, from conception to deployment. You should be comfortable around both front-end and back-end coding languages, development frameworks and third-party libraries. You should also be a team player with a knack for visual design and utility. Responsibilities: · Work with development teams and …",300000.0,1800000.0,2023-06-20T17:01:50Z,"job brief: we are looking for experience in api and node.js to produce scalable software solutions. you will be part of a cross-functional team that is responsible for the full software development life cycle, from conception to deployment. you should be comfortable around both front-end and back-end coding languages, development frameworks and third-party libraries. you should also be a team player with a knack for visual design and utility. responsibilities: · work with development teams and …",False,False,False,False,False,False,False,False,False,False,False,False,False,False,False,False
data analyst,jaipur,.NET Nodejs Developer,Celebal Technologies,"Jaipur, Rajasthan","Job Brief: We are looking for a C# .Net Developer with experience in API and Node.js to produce scalable software solutions. You will be part of a cross-functional team that is responsible for the full software development life cycle, from conception to deployment. You should be comfortable around both front-end and back-end coding languages, development frameworks and third-party libraries. You should also be a team player with a knack for visual design and utility. Responsibilities: • Work wi…",300000.0,1500000.0,2022-08-26T06:41:21Z,"job brief: we are looking for a c# .net developer with experience in api and node.js to produce scalable software solutions. you will be part of a cross-functional team that is responsible for the full software development life cycle, from conception to deployment. you should be comfortable around both front-end and back-end coding languages, development frameworks and third-party libraries. you should also be a team player with a knack for visual design and utility. responsibilities: • work wi…",False,False,False,False,False,False,False,False,False,False,False,False,False,False,False,False
data analyst,jaipur,Full Stack Developer,Infomagine Softwares Pvt Ltd,"Jaipur, Rajasthan","Description We are looking for a Full Stack Developer to produce scalable software solutions. You’ll be part of a cross-functional team that’s responsible for the full software development life cycle, from conception to deployment. As a Full Stack Developer, you should be comfortable with both front-end and back-end coding languages, development frameworks and third-party libraries. You should also be a team player with a knack for visual design and utility. If you’re also familiar with Agile m…",300000.0,1000000.0,2022-10-11T07:23:35Z,"description we are looking for a full stack developer to produce scalable software solutions. you’ll be part of a cross-functional team that’s responsible for the full software development life cycle, from conception to deployment. as a full stack developer, you should be comfortable with both front-end and back-end coding languages, development frameworks and third-party libraries. you should also be a team player with a knack for visual design and utility. if you’re also familiar with agile m…",False,False,False,False,False,False,False,False,False,False,False,False,False,False,False,False
data analyst,jaipur,Data QA Specialist,YipitData,"Jaipur, Rajasthan","About Us: YipitData is the market-leading data and analytics firm. We analyze billions of data points every day to provide accurate, detailed insights across industries, including consumer brands, technology, software, and healthcare. Our insights team uses proprietary technology to identify, license, clean, and analyze the data that many of the worlds largest investment funds and corporations depend on. We raised $475M from The Carlyle Group at a valuation over $1B, further accelerating our gr…",,,2025-02-07T11:21:48Z,"about us: yipitdata is the market-leading data and analytics firm. we analyze billions of data points every day to provide accurate, detailed insights across industries, including consumer brands, technology, software, and healthcare. our insights team uses proprietary technology to identify, license, clean, and analyze the data that many of the worlds largest investment funds and corporations depend on. we raised $475m from the carlyle group at a valuation over $1b, further accelerating our gr…",False,False,False,False,False,False,False,False,False,False,False,False,False,False,False,False
data analyst,jaipur,Senior BI Engineer (Luxembourg),Amazon,"Jaipur, Rajasthan","Are you passionate about data? Does the prospect of dealing with massive volumes of data excite you? Do you want to create the next-generation tools for intuitive data access for transportation operations? Amazon Transportation Services (ATS) is a the global middle-mile transportation organization within Amazon - as part of the transportation, we ship several millions of packages every year to customer on time with high customer excellence.Find out more about us in this video: https://www.youtu…",,,2022-06-01T21:29:10Z,"are you passionate about data? does the prospect of dealing with massive volumes of data excite you? do you want to create the next-generation tools for intuitive data access for transportation operations? amazon transportation services (ats) is a the global middle-mile transportation organization within amazon - as part of the transportation, we ship several millions of packages every year to customer on time with high customer excellence.find out more about us in this video: https://www.youtu…",False,False,True,False,False,False,False,False,False,False,False,False,False,False,False,False
data analyst,jaipur,Senior Business Intelligence Engineer (Luxembourg),Amazon,"Jaipur, Rajasthan","Are you passionate about data? Does the prospect of dealing with massive volumes of data excite you? Do you want to create the next-generation tools for intuitive data access for transportation operations? Amazon Transportation Services (ATS) is a the global middle-mile transportation organization within Amazon - as part of the transportation, we ship several millions of packages every year to customer on time with high customer excellence. Find our more about us in this video: https://www.yout…",,,2022-06-01T21:29:11Z,"are you passionate about data? does the prospect of dealing with massive volumes of data excite you? do you want to create the next-generation tools for intuitive data access for transportation operations? amazon transportation services (ats) is a the global middle-mile transportation organization within amazon - as part of the transportation, we ship several millions of packages every year to customer on time with high customer excellence. find our more about us in this video: https://www.yout…",False,False,True,False,False,False,False,False,False,False,False,False,False,False,False,False
data analyst,jaipur,Business Intelligence Engineer (Luxembourg),Amazon,"Jaipur, Rajasthan","Are you passionate about leveraging data to deliver actionable insight that impacts daily business decisions for Amazon? Does the prospect of dealing with massive volume of data excite you? Amazon Fulfillment Technologies (AFT) powers the physical engine at the heart of Amazon Retail. AFT builds and operates software, hardware, and processes that run the global network of fulfillment centers that move many millions of units of inventory, employ hundreds of thousands of employees, and ensure tha…",,,2022-06-01T21:29:10Z,"are you passionate about leveraging data to deliver actionable insight that impacts daily business decisions for amazon? does the prospect of dealing with massive volume of data excite you? amazon fulfillment technologies (aft) powers the physical engine at the heart of amazon retail. aft builds and operates software, hardware, and processes that run the global network of fulfillment centers that move many millions of units of inventory, employ hundreds of thousands of employees, and ensure tha…",False,False,False,False,False,False,False,False,False,False,False,False,False,False,False,False
data analyst,jaipur,Data Scientist (Luxembourg),Amazon,"Jaipur, Rajasthan","Are you a talented and inventive scientist with a strong passion about modern data technologies and interested to improve business processes, extracting value from the data? Would you like to be a part of an organization that is aiming to use self-learning technology to process data in order to support the management of the procurement function? The Global Procurement Technology, as a part of Global Procurement Operations, is seeking a skilled Data Scientist to help build its future data intell…",,,2022-06-01T21:29:10Z,"are you a talented and inventive scientist with a strong passion about modern data technologies and interested to improve business processes, extracting value from the data? would you like to be a part of an organization that is aiming to use self-learning technology to process data in order to support the management of the procurement function? the global procurement technology, as a part of global procurement operations, is seeking a skilled data scientist to help build its future data intell…",False,False,False,False,False,False,False,False,False,False,False,False,False,False,False,False
data analyst,ahmedabad,Data Analyst,Arvind Limited,"Ahmedabad, Gujarat","Sr. Specialist - Power BI Reporting Full-time · 5–7 Years’ Experience · Manufacturing / Retail Skills: Power BI · Report Design · DAX (Moderate) · Data Visualisation · Stakeholder Communication Manufacturing / Retail Domain About the Role We are looking for Power BI Reporting Sr. Specialist to build the reports and dashboards that help our business make better & faster decisions. The input data will be supplied from the Fabric data lake & your job is to take that data and turn it into clear, we…",,,2026-06-13T10:51:48Z,"sr. specialist - power bi reporting full-time · 5–7 years’ experience · manufacturing / retail skills: power bi · report design · dax (moderate) · data visualisation · stakeholder communication manufacturing / retail domain about the role we are looking for power bi reporting sr. specialist to build the reports and dashboards that help our business make better & faster decisions. the input data will be supplied from the fabric data lake & your job is to take that data and turn it into clear, we…",False,False,False,True,False,False,False,False,False,False,False,False,False,False,False,False
data analyst,ahmedabad,Data Analyst,Mantras2Success,"Ahmedabad, Gujarat","Job Description: Role Overview: We are looking for a detail-oriented Data Analyst who can convert complex data into meaningful insights that help drive business decisions. The ideal candidate should have strong expertise in SQL, Python, and data visualisation tools and experience working with large datasets. Key Responsibilities: Collect, clean, and analyse large datasets to identify trends and patterns. Write complex SQL and MongoDB queries to extract and manipulate data. Build dashboards and …",,,2026-05-13T02:04:45Z,"job description: role overview: we are looking for a detail-oriented data analyst who can convert complex data into meaningful insights that help drive business decisions. the ideal candidate should have strong expertise in sql, python, and data visualisation tools and experience working with large datasets. key responsibilities: collect, clean, and analyse large datasets to identify trends and patterns. write complex sql and mongodb queries to extract and manipulate data. build dashboards and …",True,True,False,False,False,False,False,False,False,False,False,False,False,False,False,False
data analyst,ahmedabad,Data Analyst,Mantras2Success,"Ahmedabad, Gujarat","Job Description: We are seeking a highly motivated Data Analyst to join our team. The successful candidate will be responsible for collecting, analysing, and interpreting data to help drive strategic and operational decisions across the business. This role involves working closely with teams across Sales, Marketing, Finance, and Operations to deliver actionable insights that improve business performance and efficiency. Key Responsibilities • Extract, clean, and analyse data from our booking sys…",,,2026-05-13T02:13:36Z,"job description: we are seeking a highly motivated data analyst to join our team. the successful candidate will be responsible for collecting, analysing, and interpreting data to help drive strategic and operational decisions across the business. this role involves working closely with teams across sales, marketing, finance, and operations to deliver actionable insights that improve business performance and efficiency. key responsibilities • extract, clean, and analyse data from our booking sys…",False,False,False,False,False,False,False,False,False,False,False,False,False,False,False,False
data analyst,ahmedabad,Data Analyst,Mantras2Success,"Ahmedabad, Gujarat","Job Description: Position Summary: We are seeking a meticulous and skilled MIS/data analyst to join our team. The ideal candidate will be proficient in advanced Excel and Google Sheets, adept at using complex formulas, and capable of transferring data from CRM software such as Skynamo, Freshsales, and Xero into Google Sheets. The role involves creating insightful dashboards and revenue models to support data-driven decision-making. Key Responsibilities: Data Management: Transfer and manage data…",,,2026-05-14T02:05:21Z,"job description: position summary: we are seeking a meticulous and skilled mis/data analyst to join our team. the ideal candidate will be proficient in advanced excel and google sheets, adept at using complex formulas, and capable of transferring data from crm software such as skynamo, freshsales, and xero into google sheets. the role involves creating insightful dashboards and revenue models to support data-driven decision-making. key responsibilities: data management: transfer and manage data…",False,False,True,False,False,False,False,False,False,False,False,False,False,False,False,False
data analyst,ahmedabad,Data Analyst,Grubbrr systems Pvt Ltd,"Ahmedabad, Gujarat","Job Responsibility: * Coordinate with CSMs to complete Pilot sales tracker, QBR Decks, End of pilot Decks *Monitor Daily Sales volume and alert CSMs of Locations with Low volume counts *Collaborate with other teammates to extract data figures, data entry (Google Sheets & Google Slides), and monitor key performance indicators (KPIs) to determine business initiatives’ success *Helping in Minor Integration Changes *Helping with Tickets and giving support when required * Basic product knowledge of …",300000.0,900000.0,2024-04-26T16:15:16Z,"job responsibility: * coordinate with csms to complete pilot sales tracker, qbr decks, end of pilot decks *monitor daily sales volume and alert csms of locations with low volume counts *collaborate with other teammates to extract data figures, data entry (google sheets & google slides), and monitor key performance indicators (kpis) to determine business initiatives’ success *helping in minor integration changes *helping with tickets and giving support when required * basic product knowledge of …",False,False,False,False,False,False,False,False,False,False,False,False,False,False,False,False
data analyst,ahmedabad,Sr. Data Analyst,Simform,"Ahmedabad, Gujarat","Job Description Job Title: Sr. Data Analyst Experience: 5 to 8 Years Location: Ahmedabad/Remote Job Type: Full Time Department: Data Engineering About Simform: Simform is a premier digital engineering company specializing in Cloud, Data, AI/ML, and Experience Engineering to create seamless digital experiences and scalable products. Simform is a strong partner for Microsoft, AWS, Google Cloud, and Databricks. With a presence in 5 countries, Simform primarily serves North America, the UK, and the…",,,2026-06-20T03:27:28Z,"job description job title: sr. data analyst experience: 5 to 8 years location: ahmedabad/remote job type: full time department: data engineering about simform: simform is a premier digital engineering company specializing in cloud, data, ai/ml, and experience engineering to create seamless digital experiences and scalable products. simform is a strong partner for microsoft, aws, google cloud, and databricks. with a presence in 5 countries, simform primarily serves north america, the uk, and the…",False,False,False,False,False,False,False,True,False,False,False,False,False,False,False,False
data analyst,ahmedabad,Senior Data Analyst,Mantras2Success,"Ahmedabad, Gujarat","Job Description: Job Summary: We are seeking an experienced Senior Data Analyst to drive data-driven decision-making across business functions. The ideal candidate should possess strong expertise in analytics, data engineering, automation, and stakeholder management. This role requires hands-on experience in building scalable ETL pipelines, analytical data models, automated reporting systems, and advanced analytics solutions. Will work closely with business, product, risk, operations, and leade…",,,2026-06-27T02:43:49Z,"job description: job summary: we are seeking an experienced senior data analyst to drive data-driven decision-making across business functions. the ideal candidate should possess strong expertise in analytics, data engineering, automation, and stakeholder management. this role requires hands-on experience in building scalable etl pipelines, analytical data models, automated reporting systems, and advanced analytics solutions. will work closely with business, product, risk, operations, and leade…",False,False,False,False,False,False,False,False,False,False,False,False,False,False,True,False
data analyst,ahmedabad,Data Engineering Lead,Kanerika Inc,"Ahmedabad, Gujarat","Role: We are hiring a Lead Data Engineer to build scalable cloud data platforms and modern ETL/ELT pipelines using Microsoft Fabric, Databricks, or Snowflake. The role involves designing Lakehouse/Data Warehouse solutions, enabling analytics, and leading data engineering best practices. Strong experience in PySpark, SQL, Python/Scala, and cloud platforms is required. What You Will Do: Following are high level responsibilities that you will play but not limited to: Lead the design, development, …",,,2026-06-26T00:55:32Z,"role: we are hiring a lead data engineer to build scalable cloud data platforms and modern etl/elt pipelines using microsoft fabric, databricks, or snowflake. the role involves designing lakehouse/data warehouse solutions, enabling analytics, and leading data engineering best practices. strong experience in pyspark, sql, python/scala, and cloud platforms is required. what you will do: following are high level responsibilities that you will play but not limited to: lead the design, development, …",True,True,False,False,False,False,False,False,False,False,True,False,False,False,True,False
data analyst,ahmedabad,We Are Hiring Data Analyst In Ahmedabad,Mspire Ventures,"Ahmedabad, Gujarat","Job Description: Job Title: Data Analyst – Location: Odhav, Ahmedabad Experience: 06–3 years (or as per requirement) Salary: 15k to 25k Job Summary: We are looking for a detail-oriented Data Analyst to manage and analyze eCommerce product data. The candidate will track product exports, sales performance, stock levels, and trends across regions, helping the management make data-driven decisions to optimize sales and inventory. Strong Excel skills are essential. Key Responsibilities: Collect, cle…",,,2026-05-13T02:18:05Z,"job description: job title: data analyst – location: odhav, ahmedabad experience: 06–3 years (or as per requirement) salary: 15k to 25k job summary: we are looking for a detail-oriented data analyst to manage and analyze ecommerce product data. the candidate will track product exports, sales performance, stock levels, and trends across regions, helping the management make data-driven decisions to optimize sales and inventory. strong excel skills are essential. key responsibilities: collect, cle…",False,False,True,False,False,False,False,False,False,False,False,False,False,False,False,False
data analyst,ahmedabad,Urgent Opening for DATA ANALYST - Ahmedabad,Kaapro Management Solutions,"Ahmedabad, Gujarat","Job Description: JOB DESCRIPTION: DATA ANALYST (Market Research / Lead Generation) Industry: (Frozen Food Manufacturing Company) Location: Ambala, Haryana Experience: 2–5 years (Market research / data analytics / lead generation) Industry Preference: FMCG, Frozen Foods, Packaged Foods, Food Processing Role Objective:- To research, collect, and analyze market data for frozen food companies, distributors, dealers, and potential clients. The Data Analyst will support the sales and marketing team b…",,,2026-05-15T02:15:40Z,"job description: job description: data analyst (market research / lead generation) industry: (frozen food manufacturing company) location: ambala, haryana experience: 2–5 years (market research / data analytics / lead generation) industry preference: fmcg, frozen foods, packaged foods, food processing role objective:- to research, collect, and analyze market data for frozen food companies, distributors, dealers, and potential clients. the data analyst will support the sales and marketing team b…",False,False,False,False,False,False,False,False,False,False,False,False,False,False,False,False
data analyst,ahmedabad,Senior Data Analyst – Cost Control,SYSTRA,"Ambawadi, Ahmedabad","It has been more than 60 years since SYSTRA has garnered expertise that spans the entire spectrum of Mass Rapid Transit System. SYSTRA India’s valuable presence in India roots back to 1957, where SYSTRA worked on the electrification of Indian Railways. Our technical excellence, holistic approach and the tremendous talent provides a career that puts people who join us at the heart of improving transportation and urban infrastructure efficiency. Understand better who we are by visiting www.systra…",,,2026-04-03T08:58:34Z,"it has been more than 60 years since systra has garnered expertise that spans the entire spectrum of mass rapid transit system. systra india’s valuable presence in india roots back to 1957, where systra worked on the electrification of indian railways. our technical excellence, holistic approach and the tremendous talent provides a career that puts people who join us at the heart of improving transportation and urban infrastructure efficiency. understand better who we are by visiting www.systra…",False,False,True,False,False,False,False,False,False,False,False,False,False,False,False,False
data analyst,ahmedabad,Data Engineer,DynaTech Systems,"Ahmedabad, Gujarat","Job Summary We are looking for a Data Engineer with 3 years of experience in designing, developing, and maintaining scalable data pipelines. The ideal candidate should have strong hands-on experience in Python, PySpark, and Databricks for building modern data engineering solutions. Key Responsibilities Develop, maintain, and optimize ETL/ELT data pipelines. Build scalable data processing solutions using Python and PySpark. Design and implement data workflows in Databricks. Perform data ingestio…",,,2026-06-26T18:55:51Z,"job summary we are looking for a data engineer with 3 years of experience in designing, developing, and maintaining scalable data pipelines. the ideal candidate should have strong hands-on experience in python, pyspark, and databricks for building modern data engineering solutions. key responsibilities develop, maintain, and optimize etl/elt data pipelines. build scalable data processing solutions using python and pyspark. design and implement data workflows in databricks. perform data ingestio…",True,False,False,False,False,False,False,False,False,False,True,False,False,False,True,False
data analyst,ahmedabad,Senior Data Analyst - Fashion / Garment Industry - Ahmedabad,Hunarstreet Technologies Pvt Ltd,"Ahmedabad, Gujarat","We are seeking a highly analytical and detail-oriented Senior Data Analyst to lead data management, reporting, automation, and system development initiatives across the organization. The role focuses on transforming raw data into meaningful insights, designing and implementing automated systems, strengthening data structures, and supporting cross-functional teams with accurate, actionable intelligence to drive strategic and operational business decisions. Key Responsibilities 1. Data Management…",480000.0,550000.0,2026-05-20T12:46:00Z,"we are seeking a highly analytical and detail-oriented senior data analyst to lead data management, reporting, automation, and system development initiatives across the organization. the role focuses on transforming raw data into meaningful insights, designing and implementing automated systems, strengthening data structures, and supporting cross-functional teams with accurate, actionable intelligence to drive strategic and operational business decisions. key responsibilities 1. data management…",False,False,False,False,False,False,False,False,False,False,False,False,False,False,False,False
