search_title,search_city,title,company,location,description,salary_min,salary_max,created,description_lower,skill_python,skill_sql,skill_excel,skill_power_bi,skill_tableau,skill_machine_learning,skill_r_programming,skill_aws,skill_azure,skill_statistics,skill_spark,skill_hadoop,skill_deep_learning,skill_data_visualization,skill_etl,skill_java
data scientist,jaipur,Data Scientist,UiPath,"Jaipur, Rajasthan","Life at UiPath The people at UiPath believe in the transformative power of automation to change how the world works. We’re committed to creating category-leading enterprise software that unleashes that power. To make that happen, we need people who are curious, self-propelled, generous, and genuine. People who love being part of a fast-moving, fast-thinking growth company. And people who care—about each other, about UiPath, and about our larger purpose. Could that be you? Your mission This role…",,,2026-02-19T02:06:22Z,"life at uipath the people at uipath believe in the transformative power of automation to change how the world works. we’re committed to creating category-leading enterprise software that unleashes that power. to make that happen, we need people who are curious, self-propelled, generous, and genuine. people who love being part of a fast-moving, fast-thinking growth company. and people who care—about each other, about uipath, and about our larger purpose. could that be you? your mission this role…",False,False,False,False,False,False,False,False,False,False,False,False,False,False,False,False
data scientist,jaipur,Generative AI Engineer,LearningBIX,"Jaipur, Rajasthan","About LearningBIX LearningBIX is committed to inspiring the innovators of tomorrow by providing hands-on learning solutions that empower students to bring their creative ideas to life. The company focuses on strengthening STEM education through technology-driven learning tools, practical innovation, and engaging educational experiences. We are building AI-powered educational solutions for students and teachers, including offline AI tutors, bilingual learning systems. Role Overview We are lookin…",,,2026-06-27T15:01:22Z,"about learningbix learningbix is committed to inspiring the innovators of tomorrow by providing hands-on learning solutions that empower students to bring their creative ideas to life. the company focuses on strengthening stem education through technology-driven learning tools, practical innovation, and engaging educational experiences. we are building ai-powered educational solutions for students and teachers, including offline ai tutors, bilingual learning systems. role overview we are lookin…",False,False,False,False,False,False,False,False,False,False,False,False,False,False,False,False
data scientist,jaipur,Principal Data Scientist,Benovymed Healthcare,"Jaipur, Rajasthan","Key Responsibilities Develop and implement advanced machine learning models, statistical algorithms, and predictive analytics solutions to support business objectives. Collaborate with stakeholders to identify business problems and translate them into data science solutions. Design and develop data visualizations, dashboards, and reports to communicate insights to non-technical stakeholders. Work closely with data engineering teams to integrate data from multiple sources into unified data platf…",,,2026-05-24T06:57:09Z,"key responsibilities develop and implement advanced machine learning models, statistical algorithms, and predictive analytics solutions to support business objectives. collaborate with stakeholders to identify business problems and translate them into data science solutions. design and develop data visualizations, dashboards, and reports to communicate insights to non-technical stakeholders. work closely with data engineering teams to integrate data from multiple sources into unified data platf…",False,False,False,False,False,True,False,False,False,False,False,False,False,True,False,False
data scientist,jaipur,Python AI/ML Intern,Durapid Technologies Pvt Ltd,"Jaipur, Rajasthan","Key Responsibilities:- • Assist in designing and developing AI/ML-based solutions using Python. • Support the team in data cleaning, preprocessing, and preparation for model building. • Work with mentors to implement, test, and validate ML models. • Participate in integrating AI/ML solutions into applications. • Conduct research and stay updated with the latest trends in AI/ML. • Collaborate with software engineers and data scientists on project tasks. Required Skills & Qualifications:- • Stron…",100000.0,120000.0,2026-06-05T06:20:23Z,"key responsibilities:- • assist in designing and developing ai/ml-based solutions using python. • support the team in data cleaning, preprocessing, and preparation for model building. • work with mentors to implement, test, and validate ml models. • participate in integrating ai/ml solutions into applications. • conduct research and stay updated with the latest trends in ai/ml. • collaborate with software engineers and data scientists on project tasks. required skills & qualifications:- • stron…",True,False,False,False,False,False,False,False,False,False,False,False,False,False,False,False
data scientist,jaipur,AI/ML,Nexus Jobs,"Jaipur, Rajasthan","We're Hiring | AI/ML Engineer (Training & Development) – Female Candidate Preferred We are looking for a passionate and skilled Female AI/ML Engineer who can conduct engaging training sessions while also contributing to AI/ML development projects. The ideal candidate should have strong technical expertise along with excellent communication and presentation skills. Experience: 2–3 Years Key Skills: Python, Machine Learning, Deep Learning, Generative AI, LLMs, NLP, Computer Vision, LangChain, RAG…",300000.0,420000.0,2026-06-04T12:58:28Z,"we're hiring | ai/ml engineer (training & development) – female candidate preferred we are looking for a passionate and skilled female ai/ml engineer who can conduct engaging training sessions while also contributing to ai/ml development projects. the ideal candidate should have strong technical expertise along with excellent communication and presentation skills. experience: 2–3 years key skills: python, machine learning, deep learning, generative ai, llms, nlp, computer vision, langchain, rag…",True,False,True,False,False,True,False,False,False,False,False,False,True,False,False,False
data scientist,jaipur,Senior Business Analyst,Talentvibes Solutions,"Jaipur, Rajasthan","Senior Business Analyst Job Summary We are seeking an experienced Senior Business Analyst to lead business analysis activities, collaborate with senior management, and contribute to strategic initiatives that align with the organization's goals. The Senior Business Analyst will play a key role in driving business process improvements, optimizing efficiency, and ensuring the successful execution of projects. The role involves working with cross-functional teams, providing leadership and mentorsh…",1000000.0,1400000.0,2025-10-07T06:43:38Z,"senior business analyst job summary we are seeking an experienced senior business analyst to lead business analysis activities, collaborate with senior management, and contribute to strategic initiatives that align with the organization's goals. the senior business analyst will play a key role in driving business process improvements, optimizing efficiency, and ensuring the successful execution of projects. the role involves working with cross-functional teams, providing leadership and mentorsh…",False,False,False,False,False,False,False,False,False,False,False,False,False,False,False,False
data scientist,jaipur,Big Data Engineer,YourHRfolks,"Jaipur, Rajasthan","Position: Big Data Engineer What You'll Do Punchh is seeking to hire Big Data Engineer at either a senior or tech lead level. Reporting to the Director of Big Data, he/she will play a critical role in leading Punchh’s big data innovations. By leveraging prior industrial experience in big data, he/she will help create cutting-edge data and analytics products for Punchh’s business partners. This role requires close collaborations with data, engineering, and product organizations. His/her job func…",750000.0,3000000.0,2021-05-26T12:52:33Z,"position: big data engineer what you'll do punchh is seeking to hire big data engineer at either a senior or tech lead level. reporting to the director of big data, he/she will play a critical role in leading punchh’s big data innovations. by leveraging prior industrial experience in big data, he/she will help create cutting-edge data and analytics products for punchh’s business partners. this role requires close collaborations with data, engineering, and product organizations. his/her job func…",False,False,False,False,False,False,False,False,False,False,False,False,False,False,False,False
data scientist,jaipur,Java Developer,Auriga IT Consulting Pvt Ltd,"Jaipur, Rajasthan","Auriga IT, founded in 2010, is a trusted digital solution partner based in Jaipur. They bring together design, technology, and data capabilities to help organizations launch new businesses and drive transformation in the digital age. Their offerings include user experience and design, digital product development, enterprise applications and modernization, process automation, ERP and CRM implementation, and data science. Auriga has a strong track record of providing tailor-made IT solutions and …",1800000.0,2500000.0,2024-07-05T10:34:38Z,"auriga it, founded in 2010, is a trusted digital solution partner based in jaipur. they bring together design, technology, and data capabilities to help organizations launch new businesses and drive transformation in the digital age. their offerings include user experience and design, digital product development, enterprise applications and modernization, process automation, erp and crm implementation, and data science. auriga has a strong track record of providing tailor-made it solutions and …",False,False,False,False,False,False,False,False,False,False,False,False,False,False,False,False
data scientist,jaipur,Azure DevOps Lead,Celebal Technologies Pvt Ltd,"Jaipur, Rajasthan","About Us - Celebal Technologies is a premier software services company in the field of Data Science, Big Data and Enterprise Cloud. Celebal Technologies helps you to discover the competitive advantage by employing intelligent data solutions using cutting-edge technology solutions that can bring massive value to your organization. The core offerings are around ""Data to Intelligence"", wherein we leverage data to extract intelligence and patterns thereby facilitating smarter and quicker decision m…",1800000.0,2500000.0,2023-04-11T10:12:10Z,"about us - celebal technologies is a premier software services company in the field of data science, big data and enterprise cloud. celebal technologies helps you to discover the competitive advantage by employing intelligent data solutions using cutting-edge technology solutions that can bring massive value to your organization. the core offerings are around ""data to intelligence"", wherein we leverage data to extract intelligence and patterns thereby facilitating smarter and quicker decision m…",False,False,False,False,False,False,False,False,False,False,False,False,False,False,False,False
data scientist,jaipur,Associate Consultant,Cipher Research Group,"Jaipur, Rajasthan","Responsibilities and Duties • Provide technology consulting services to law firms and corporates • Understand underlying technologies to analyze patent portfolios and help solve clients’ core technical queries • Conduct research & analysis, including but not limited to technology due diligence, market research, prior art searches, target scouting, invalidity analysis, infringement analysis and claim charting • Be a part of the product development team in developing the legal tech product. • Wor…",800000.0,1100000.0,2019-06-05T21:12:02Z,"responsibilities and duties • provide technology consulting services to law firms and corporates • understand underlying technologies to analyze patent portfolios and help solve clients’ core technical queries • conduct research & analysis, including but not limited to technology due diligence, market research, prior art searches, target scouting, invalidity analysis, infringement analysis and claim charting • be a part of the product development team in developing the legal tech product. • wor…",False,False,False,False,False,False,False,False,False,False,False,False,False,False,False,False
data scientist,ahmedabad,Statistician / Data Scientist,Radix Analytics Pvt Ltd,"Ahmedabad, Gujarat","Job Summary We are seeking a highly motivated and analytical Statistician / Data Scientist to join our team. The ideal candidate will have a strong foundation in statistics, machine learning, and data analysis, along with hands-on experience in developing predictive and analytical models. The candidate should be capable of transforming complex data into actionable insights and delivering data-driven solutions to solve business problems. Key Responsibilities Build, validate, and deploy statistic…",,,2026-06-18T15:54:33Z,"job summary we are seeking a highly motivated and analytical statistician / data scientist to join our team. the ideal candidate will have a strong foundation in statistics, machine learning, and data analysis, along with hands-on experience in developing predictive and analytical models. the candidate should be capable of transforming complex data into actionable insights and delivering data-driven solutions to solve business problems. key responsibilities build, validate, and deploy statistic…",False,False,False,False,False,True,False,False,False,True,False,False,False,False,False,False
data scientist,ahmedabad,Data Science: AI/ML / Statistics / OR,Radix Analytics Pvt Ltd,"Ahmedabad, Gujarat","Key Responsibilities Design, develop and implement operations research, statistical, ML & AI models and algorithms for structured, unstructured text & image data. Understand and run efficient analytic database queries, work with datalakes & warehouses. Design, develop and implement data pipelines, APIs & agents using above models. Understand MLOps for model & data pipeline for managing continuous development/improvement of predictive and prescriptive models to support decision-making software s…",,,2026-06-11T21:10:27Z,"key responsibilities design, develop and implement operations research, statistical, ml & ai models and algorithms for structured, unstructured text & image data. understand and run efficient analytic database queries, work with datalakes & warehouses. design, develop and implement data pipelines, apis & agents using above models. understand mlops for model & data pipeline for managing continuous development/improvement of predictive and prescriptive models to support decision-making software s…",False,False,False,False,False,False,False,False,False,False,False,False,False,False,False,False
data scientist,ahmedabad,Data Architect - Gen AI,eInfochips ,"Ahmedabad, Gujarat","Role : GenAI Data Architect Location: Ahmedabad Experience: 8 - 12 Years Looking for immediate joiners or candidates with a notice period of up to 30 days. Job Description: A highly skilled and motivated AI Architect for designing, developing, and implementing artificial intelligence (AI) solutions within an organization. The role focuses on leveraging AI & GenAI technologies, machine learning (ML), natural language processing (NLP), computer vision, and predictive analytics to solve complex bu…",,,2026-06-13T10:50:00Z,"role : genai data architect location: ahmedabad experience: 8 - 12 years looking for immediate joiners or candidates with a notice period of up to 30 days. job description: a highly skilled and motivated ai architect for designing, developing, and implementing artificial intelligence (ai) solutions within an organization. the role focuses on leveraging ai & genai technologies, machine learning (ml), natural language processing (nlp), computer vision, and predictive analytics to solve complex bu…",False,False,False,False,False,True,False,False,False,False,False,False,False,False,False,False
data scientist,ahmedabad,Assistant Professor for Artificial Intelligence,SKIPS University,"Ahmedabad, Gujarat","Organization: SKIPS University Position Type: Visiting Faculty / Part-Time / Full-Time Location: Ahmedabad, Gujarat Department: Computer Applications / Management / Emerging Technologies Job Summary SKIPS University is seeking a knowledgeable and passionate *AI Trainer (Visiting Faculty)* to deliver practical and industry-oriented training in Artificial Intelligence (AI), Generative AI, Machine Learning, and related technologies. The trainer will be responsible for conducting interactive sessio…",,,2026-06-27T14:59:27Z,"organization: skips university position type: visiting faculty / part-time / full-time location: ahmedabad, gujarat department: computer applications / management / emerging technologies job summary skips university is seeking a knowledgeable and passionate *ai trainer (visiting faculty)* to deliver practical and industry-oriented training in artificial intelligence (ai), generative ai, machine learning, and related technologies. the trainer will be responsible for conducting interactive sessio…",False,False,False,False,False,True,False,False,False,False,False,False,False,False,False,False
data scientist,ahmedabad,AI ML Architect,Techsara Solutions,"Ahmedabad, Gujarat","Techsara Solutions is expanding its AI Consulting & Delivery practice and is looking for an experienced AI/ML Solutions Architect / Practice Lead to help build and lead next-generation AI solutions for global clients. AI ML Technical Architect_ JD.pdf What You'll Do:  Design and architect AI/ML and Generative AI solutions  Lead client discovery sessions and technical solutioning  Build applications leveraging LLMs, RAG, AI Agents, and Automation  Mentor AI/ML consultants and guide technical del…",,,2026-06-26T14:58:46Z,"techsara solutions is expanding its ai consulting & delivery practice and is looking for an experienced ai/ml solutions architect / practice lead to help build and lead next-generation ai solutions for global clients. ai ml technical architect_ jd.pdf what you'll do:  design and architect ai/ml and generative ai solutions  lead client discovery sessions and technical solutioning  build applications leveraging llms, rag, ai agents, and automation  mentor ai/ml consultants and guide technical del…",False,False,False,False,False,False,False,False,False,False,False,False,False,False,False,False
data scientist,ahmedabad,Financial Analyst,RHC India,"Ahmedabad, Gujarat","About the Company: Relay Human Cloud is a young & dynamic company that helps some of the top US-based companies to expand their team internationally. Relay is a truly global company having its operations in US, India, Honduras, and Mexico (We are also adding a few more countries soon). Our core focus is to enable companies to connect with the best international talent. Relay helps its clients in majorly following areas: Accounting & Finance, Administration, Operations, Space Planning, Leasing, …",,,2026-06-25T18:52:11Z,"about the company: relay human cloud is a young & dynamic company that helps some of the top us-based companies to expand their team internationally. relay is a truly global company having its operations in us, india, honduras, and mexico (we are also adding a few more countries soon). our core focus is to enable companies to connect with the best international talent. relay helps its clients in majorly following areas: accounting & finance, administration, operations, space planning, leasing, …",False,False,False,False,False,False,False,False,False,False,False,False,False,False,False,False
data scientist,ahmedabad,US Property Accountant,RHC India,"Ahmedabad, Gujarat","About the Company: Relay Human Cloud is a young & dynamic company that helps some of the top US-based companies to expand their team internationally. Relay is a truly global company having its operations in US, India, Honduras, and Mexico (We are also adding a few more countries soon). Our core focus is to enable companies to connect with the best international talent. Relay helps its clients in majorly following areas: Accounting & Finance, Administration, Operations, Space Planning, Leasing, …",,,2026-06-18T15:55:40Z,"about the company: relay human cloud is a young & dynamic company that helps some of the top us-based companies to expand their team internationally. relay is a truly global company having its operations in us, india, honduras, and mexico (we are also adding a few more countries soon). our core focus is to enable companies to connect with the best international talent. relay helps its clients in majorly following areas: accounting & finance, administration, operations, space planning, leasing, …",False,False,False,False,False,False,False,False,False,False,False,False,False,False,False,False
data scientist,ahmedabad,US Property Accountant - Yardi,RHC India,"Ahmedabad, Gujarat","About the Company: Relay Human Cloud is a young & dynamic company that helps some of the top US-based companies to expand their team internationally. Relay is a truly global company having its operations in US, India, Honduras, and Mexico (We are also adding a few more countries soon). Our core focus is to enable companies to connect with the best international talent. Relay helps its clients in majorly following areas: Accounting & Finance, Administration, Operations, Space Planning, Leasing, …",,,2026-06-21T19:38:02Z,"about the company: relay human cloud is a young & dynamic company that helps some of the top us-based companies to expand their team internationally. relay is a truly global company having its operations in us, india, honduras, and mexico (we are also adding a few more countries soon). our core focus is to enable companies to connect with the best international talent. relay helps its clients in majorly following areas: accounting & finance, administration, operations, space planning, leasing, …",False,False,False,False,False,False,False,False,False,False,False,False,False,False,False,False
data scientist,ahmedabad,Assistant Professor of Computer Science,SKIPS University,"Ahmedabad, Gujarat","Education - Teaching and Training To teach and examine courses at BCA, B.Sc IT & M.sc IT through lectures, seminars, tutorials, course work and personal supervision. To teach Computer Science related subjects in BCA, B.Sc IT & M.sc IT Program. To plan and review own approach to teaching. To act as a coach and role model through excellent practice and mentoring. To provide pastoral support for students. To contribute to curriculum development. To take a leading role in, or contribute to, the dev…",,,2026-06-11T21:11:28Z,"education - teaching and training to teach and examine courses at bca, b.sc it & m.sc it through lectures, seminars, tutorials, course work and personal supervision. to teach computer science related subjects in bca, b.sc it & m.sc it program. to plan and review own approach to teaching. to act as a coach and role model through excellent practice and mentoring. to provide pastoral support for students. to contribute to curriculum development. to take a leading role in, or contribute to, the dev…",False,False,True,False,False,False,False,False,False,False,False,False,False,False,False,False
data scientist,ahmedabad,Data Scientist,OfficeDay Innovation,"Ahmedabad, Gujarat","3 years of Experience majoring in applying AI/ML/ NLP / deep learning / data-driven statistical analysis & modelling solutions. Programming skills in Python, knowledge in Statistics. Hands-on experience developing supervised and unsupervised machine learning algorithms (regression, decision trees/random forest, neural networks, feature selection/reduction, clustering, parameter tuning, etc.). Familiarity with reinforcement learning is highly desirable. Experience in the financial domain and fam…",1000000.0,1200000.0,2022-12-14T06:10:48Z,"3 years of experience majoring in applying ai/ml/ nlp / deep learning / data-driven statistical analysis & modelling solutions. programming skills in python, knowledge in statistics. hands-on experience developing supervised and unsupervised machine learning algorithms (regression, decision trees/random forest, neural networks, feature selection/reduction, clustering, parameter tuning, etc.). familiarity with reinforcement learning is highly desirable. experience in the financial domain and fam…",True,False,False,False,False,True,False,False,False,True,False,False,True,False,False,False
